{
  "$schema": "http://json-schema.org/draft-07/schema#",
  "title": "MinimizerIndexJson",
  "description": "Contains external configuration and data specific for a particular pathogen",
  "type": "object",
  "required": [
    "params",
    "schemaVersion",
    "version"
  ],
  "properties": {
    "schemaVersion": {
      "type": "string"
    },
    "version": {
      "type": "string"
    },
    "params": {
      "$ref": "#/definitions/MinimizerIndexParams"
    },
    "minimizers": {
      "type": "object",
      "additionalProperties": {
        "type": "array",
        "items": {
          "type": "integer",
          "format": "uint",
          "minimum": 0.0
        }
      }
    },
    "references": {
      "type": "array",
      "items": {
        "$ref": "#/definitions/MinimizerIndexRefInfo"
      }
    },
    "normalization": {
      "type": "array",
      "items": {
        "type": "number",
        "format": "double"
      }
    }
  },
  "definitions": {
    "MinimizerIndexParams": {
      "type": "object",
      "required": [
        "cutoff",
        "k"
      ],
      "properties": {
        "k": {
          "type": "integer",
          "format": "int64"
        },
        "cutoff": {
          "type": "integer",
          "format": "int64"
        }
      }
    },
    "MinimizerIndexRefInfo": {
      "type": "object",
      "required": [
        "length",
        "nMinimizers",
        "name"
      ],
      "properties": {
        "length": {
          "type": "integer",
          "format": "int64"
        },
        "name": {
          "type": "string"
        },
        "nMinimizers": {
          "description": "Deprecated: prefer `expected_minimizer_hits`. Retained as the integer score denominator for older clients. For indexes that provide both fields it is the rounded `expected_minimizer_hits`; older indexes instead carry the literal count of stored minimizers.",
          "deprecated": true,
          "type": "integer",
          "format": "int64"
        },
        "expectedMinimizerHits": {
          "description": "Exact fractional expected number of minimizer hits from a single reference. Preferred as the score denominator when present; absent in older indexes, which fall back to `n_minimizers`.",
          "type": [
            "number",
            "null"
          ],
          "format": "double"
        }
      }
    }
  }
}