{
  "schemaVersion": "3.0.0",
  "version": "1",
  "params": { "k": 17, "cutoff": 268435456 },
  "minimizers": {
    "7109123": [0],
    "7814540": [0],
    "7975882": [0],
    "17271167": [0],
    "18882896": [0],
    "27254299": [0],
    "62124411": [0],
    "81339707": [0],
    "127321929": [0],
    "150295697": [0],
    "154110638": [0],
    "183123396": [0],
    "193338009": [0],
    "200885745": [0],
    "203424772": [0],
    "212999415": [0],
    "224579879": [0],
    "230442099": [0],
    "267196837": [0]
  },
  "references": [{ "length": 259, "name": "ref", "nMinimizers": 19, "expectedMinimizerHits": 19.0 }],
  "normalization": []
}
